<?xml version="1.0"?>
<grammar name="openccgbank"
  xmlns:xsi="http://www.w3.org/2001/XMLSchema-instance"
  xsi:noNamespaceSchemaLocation="../../grammars/grammar.xsd"
>

  <lexicon file="lexicon.xml" openlex="true"/>
  <morphology file="morph.xml"/>
  <rules file="rules.xml" combosfile="info/combos-train"/>

  <tokenizer replacement-sem-classes="DATE LOCATION MONEY ORGANIZATION PERCENT PERSON TIME"/>

  <LF-from-XML>
    <transform file="convert-to-hlds.xsl"/>
    <transform file="add-chunks.xsl"/>
  </LF-from-XML>

  <LF-to-XML>
    <transform file="raise-nodes.xsl"/>
    <transform file="convert-to-graph.xsl"/>
  </LF-to-XML>

</grammar>
